{
  "schemaVersion": "stackkit.advanced-operations/v1",
  "program": "stackkit",
  "description": "Advanced operations an orchestrator may dispatch to the stackkit CLI of the exact pinned release. Argv words follow the program name; every {placeholder} is replaced by exactly one argv word and never by shell text. Only entries with status available may be dispatched. The catalog shipped in the pinned release archive is authoritative for that release.",
  "commandResult": {
    "schemaVersion": "stackkit.command-result/v1",
    "schema": "schemas/stackkit-command-result-v1.schema.json",
    "statuses": [
      "success",
      "failed",
      "denied"
    ],
    "noEnvelope": "A nonzero exit without one stackkit.command-result/v1 document on stdout is an unclassified failure; stderr carries the message. Treat it as failed and never retry a mutating operation blindly."
  },
  "rolloutEvents": {
    "schemaVersion": "stackkit.rollout-event/v1",
    "schema": "schemas/stackkit-rollout-event.schema.json",
    "argv": [
      "--progress-jsonl",
      "{progressFile}"
    ],
    "description": "Redacted JSONL progress written to a file; `-` (stdout) is refused together with --json. Each operation lists its Advanced phases; generic lifecycle phases of the governed transaction may also appear."
  },
  "denial": {
    "schemaVersion": "stackkit.operation-denial/v1",
    "schema": "schemas/stackkit-operation-denial-v1.schema.json",
    "commandResultStatus": "denied",
    "reasonCodes": [
      {
        "code": "advanced_trust_bundle_unavailable",
        "description": "No Owner-approved issuer trust is imported; run advanced.trust.import."
      },
      {
        "code": "advanced_capability_required",
        "description": "The operation requires a capability."
      },
      {
        "code": "advanced_capability_unavailable",
        "description": "No capability file was supplied."
      },
      {
        "code": "advanced_capability_malformed",
        "description": "The capability is not the canonical stackkit.advanced-capability/v1 form."
      },
      {
        "code": "advanced_capability_untrusted_key",
        "description": "The capability key is not in the imported trust."
      },
      {
        "code": "advanced_capability_signature_invalid",
        "description": "The capability signature does not verify."
      },
      {
        "code": "advanced_capability_not_yet_valid",
        "description": "issuedAt is in the future."
      },
      {
        "code": "advanced_capability_expired",
        "description": "expiresAt has passed; issue a new capability."
      },
      {
        "code": "advanced_capability_lifetime_exceeded",
        "description": "The capability lifetime exceeds the maximum."
      },
      {
        "code": "advanced_capability_scope_mismatch",
        "description": "stackId, ownerRef or another scoped claim does not match the local stack."
      },
      {
        "code": "advanced_capability_operation_denied",
        "description": "allowedOperations does not contain the operation."
      },
      {
        "code": "advanced_change_set_invalid",
        "description": "The change-set request or record is invalid."
      },
      {
        "code": "advanced_change_set_stale",
        "description": "The change set no longer matches the current baseline; create a new one."
      },
      {
        "code": "advanced_change_set_io",
        "description": "The change-set record could not be read or written."
      },
      {
        "code": "origin_certificate_invalid",
        "description": "The origin certificate request or delivered certificate is invalid (hostname outside the managed zone, no pending request, or a certificate that does not match the node key)."
      },
      {
        "code": "owner_approval_required",
        "description": "The operation requires --owner-approve."
      },
      {
        "code": "restore_drill_request_invalid",
        "description": "The restore-drill request is invalid (anchor, operation ID or workspace state)."
      },
      {
        "code": "advanced_rollback_request_invalid",
        "description": "The rollback request is invalid (--to is not a sha256 snapshot or change-set ID)."
      },
      {
        "code": "terramate_tool_missing",
        "description": "The packaged Terramate or OpenTofu binary is absent."
      },
      {
        "code": "invalid_reconcile_mode",
        "description": "drift reconcile --mode is neither standard nor advanced."
      }
    ]
  },
  "globalArgs": [
    {
      "argv": [
        "--chdir",
        "{workspaceDir}"
      ],
      "description": "Run against the StackKit workspace directory."
    },
    {
      "argv": [
        "--correlation-id",
        "{correlationId}"
      ],
      "description": "Validated caller correlation ID recorded in local rollout evidence."
    }
  ],
  "placeholders": [
    {
      "name": "workloadRef",
      "description": "Exact selected application workload."
    },
    {
      "name": "containerId",
      "description": "Exact immutable Docker container ID.",
      "pattern": "^[0-9a-f]{64}$"
    },
    {
      "name": "planDigest",
      "description": "Reviewed source-bound application adoption digest.",
      "pattern": "^sha256:[0-9a-f]{64}$"
    },
    {
      "name": "applicationAction",
      "description": "Admitted adopted-container power action.",
      "pattern": "^(start|stop|restart)$"
    },
    {
      "name": "connectorRequestFile",
      "description": "Workspace-relative private metadata-only Home Assistant connector request."
    },
    {
      "name": "ownerFile",
      "description": "Workspace-relative private native application Owner grant file."
    },
    {
      "name": "anchorId",
      "description": "Existing snapshot-anchor ID in local custody."
    },
    {
      "name": "bundleFile",
      "description": "Path to the canonical Advanced trust bundle file."
    },
    {
      "name": "bundleSha256",
      "description": "Exact digest of the trust bundle bytes.",
      "pattern": "^sha256:[0-9a-f]{64}$"
    },
    {
      "name": "candidateSpecFile",
      "description": "Path to the candidate StackSpec v2 file."
    },
    {
      "name": "capabilityFile",
      "description": "Path to the canonical capability file."
    },
    {
      "name": "changeSetId",
      "description": "Content address of the Owner-signed change set.",
      "pattern": "^sha256:[0-9a-f]{64}$"
    },
    {
      "name": "changeSetSha256",
      "description": "Exact digest of the stored change-set bytes.",
      "pattern": "^sha256:[0-9a-f]{64}$"
    },
    {
      "name": "certificateFile",
      "description": "Path to the PEM origin certificate delivered by Techstack."
    },
    {
      "name": "hostsCsv",
      "description": "Comma-separated managed kombify.me hostnames.",
      "pattern": "^[a-z0-9*][a-z0-9.*,-]*$"
    },
    {
      "name": "correlationId",
      "description": "Caller correlation ID."
    },
    {
      "name": "operationId",
      "description": "Stable lowercase operation ID.",
      "pattern": "^[a-z0-9][a-z0-9._-]{7,99}$"
    },
    {
      "name": "progressFile",
      "description": "Path the rollout event JSONL is written to; never `-` together with --json."
    },
    {
      "name": "targetRef",
      "description": "Rollback target: an executor-state snapshot ID, or the change-set ID whose pre-apply checkpoint is the target.",
      "pattern": "^sha256:[0-9a-f]{64}$"
    },
    {
      "name": "workspaceDir",
      "description": "StackKit workspace directory."
    }
  ],
  "operations": [
    {
      "operation": "advanced.trust.import",
      "status": "available",
      "sinceRelease": "v0.15.8",
      "summary": "Import the exact pinned Techstack issuer trust bundle into local Owner custody; prerequisite of every capability-gated operation.",
      "command": "stackkit advanced trust import",
      "argv": [
        "advanced",
        "trust",
        "import",
        "--bundle",
        "{bundleFile}",
        "--expect-sha256",
        "{bundleSha256}",
        "--owner-approve",
        "--json"
      ],
      "optionalArgs": [],
      "mutates": true,
      "requires": {
        "capability": false,
        "trustImported": false,
        "ownerApproval": true,
        "candidateSpec": false,
        "changeSet": false
      },
      "inputs": [
        {
          "placeholder": "bundleFile",
          "schemaVersion": "stackkit.advanced-trust-bundle/v1",
          "schema": "schemas/stackkit-advanced-trust-bundle-v1.schema.json",
          "description": "Canonical trust bundle; {bundleSha256} pins its exact bytes."
        }
      ],
      "results": [
        {
          "status": "success",
          "schemaVersion": "stackkit.local-advanced-trust/v1",
          "schema": "schemas/stackkit-local-advanced-trust-v1.schema.json"
        }
      ],
      "events": [],
      "modes": {
        "standard": "owner-approval",
        "advanced": "owner-approval"
      }
    },
    {
      "operation": "advanced.trust.inspect",
      "status": "available",
      "sinceRelease": "v0.15.8",
      "summary": "Read the verified local Advanced issuer trust.",
      "command": "stackkit advanced trust inspect",
      "argv": [
        "advanced",
        "trust",
        "inspect",
        "--json"
      ],
      "optionalArgs": [],
      "mutates": false,
      "requires": {
        "capability": false,
        "trustImported": true,
        "ownerApproval": false,
        "candidateSpec": false,
        "changeSet": false
      },
      "inputs": [],
      "results": [
        {
          "status": "success",
          "schemaVersion": "stackkit.local-advanced-trust/v1",
          "schema": "schemas/stackkit-local-advanced-trust-v1.schema.json"
        }
      ],
      "events": [],
      "modes": {
        "standard": "allowed",
        "advanced": "allowed"
      }
    },
    {